{
  "schema_version": "execution_lineage.task.v1",
  "task_id": "unrelated_branch_noop_update",
  "task_family": "fast_dag_demo",
  "title": "Telehealth policy brief with unrelated recruiting update",
  "instruction": "Produce a policy memo recommending whether a multistate health system should expand telehealth service lines for follow-up behavioral-health and chronic-care visits over the next 24 months. The memo must synthesize current evidence, preserve unresolved tensions, and avoid using adjacent but decision-irrelevant materials.",
  "requested_output_format": {
    "deliverable": "final_memo",
    "sections": [
      "Recommendation",
      "Current Evidence",
      "Risks and Tensions",
      "Operational Implications",
      "Open Questions"
    ],
    "length_guidance": "700-1000 words"
  },
  "workflow_stages": [
    {
      "id": "utilization_context",
      "label": "Utilization Context",
      "purpose": "Summarize current utilization and adoption evidence."
    },
    {
      "id": "reimbursement_context",
      "label": "Reimbursement Context",
      "purpose": "Summarize current reimbursement and parity evidence."
    },
    {
      "id": "operations_context",
      "label": "Operations Context",
      "purpose": "Summarize current compliance, workflow, and adoption constraints."
    },
    {
      "id": "access_cost_context",
      "label": "Access vs Cost Context",
      "purpose": "Summarize access benefits, continuity gains, and cost uncertainty."
    },
    {
      "id": "provider_recruiting_note",
      "label": "Provider Recruiting Note",
      "purpose": "Summarize the separate provider recruiting and staffing branch."
    },
    {
      "id": "claim_matrix",
      "label": "Claim Matrix",
      "purpose": "Map candidate claims to current supporting sources and mark stale or excluded claims.",
      "depends_on": [
        "utilization_context",
        "reimbursement_context",
        "operations_context",
        "access_cost_context"
      ]
    },
    {
      "id": "tension_analysis",
      "label": "Tension Analysis",
      "purpose": "Preserve conflicts and unresolved uncertainties.",
      "depends_on": [
        "access_cost_context"
      ]
    },
    {
      "id": "recommendation_criteria",
      "label": "Recommendation Criteria",
      "purpose": "Define recommendation criteria grounded in current claims and tensions.",
      "depends_on": [
        "claim_matrix",
        "tension_analysis"
      ]
    },
    {
      "id": "final_memo",
      "label": "Final Memo",
      "purpose": "Write the final memo using only the declared telehealth decision artifacts.",
      "depends_on": [
        "claim_matrix",
        "tension_analysis",
        "recommendation_criteria"
      ]
    }
  ],
  "initial_stage_source_ids": {
    "utilization_context": ["S1"],
    "reimbursement_context": ["S2_current"],
    "operations_context": ["S3_current", "S6", "S7"],
    "access_cost_context": ["S4_current", "S5_current"],
    "provider_recruiting_note": ["R1_old"]
  },
  "updated_stage_source_ids": {
    "utilization_context": ["S1"],
    "reimbursement_context": ["S2_current"],
    "operations_context": ["S3_current", "S6", "S7"],
    "access_cost_context": ["S4_current", "S5_current"],
    "provider_recruiting_note": ["R1_current"]
  },
  "update_user_note": "One of the supporting materials was updated. Revise the memo only if the current evidence changes the telehealth service-line recommendation.",
  "source_file": "sources.json",
  "ground_truth_file": "ground_truth.json",
  "edits_file": "edits.json",
  "memory_file": "memory/INDEX.md",
  "manual_intermediates": {
    "claim_matrix_current": [
      "Expand behavioral-health follow-up more confidently than chronic-care follow-up.",
      "Do not claim universal parity or system-wide savings.",
      "Use payer validation, state-cluster compliance readiness, and utilization controls as rollout gates."
    ],
    "tension_analysis_current": [
      "Access gains and continuity benefits can coexist with utilization growth and cost uncertainty.",
      "The recommendation should stay focused on telehealth evidence, not adjacent staffing strategy."
    ]
  }
}
