{
  "schema_version": "execution_lineage.task.v1",
  "task_id": "intermediate_artifact_edit",
  "task_family": "fast_dag_demo",
  "title": "Telehealth policy brief with updated recommendation criteria",
  "instruction": "Produce a policy memo recommending whether a multistate health system should expand telehealth service lines for follow-up behavioral-health and chronic-care visits over the next 24 months. The memo must synthesize current evidence, preserve unresolved tensions, and reflect the current decision criteria and implementation guardrails.",
  "requested_output_format": {
    "deliverable": "final_memo",
    "sections": [
      "Recommendation",
      "Current Evidence",
      "Risks and Tensions",
      "Operational Implications",
      "Open Questions"
    ],
    "length_guidance": "700-1000 words"
  },
  "workflow_stages": [
    {
      "id": "utilization_context",
      "label": "Utilization Context",
      "purpose": "Summarize current utilization and adoption evidence."
    },
    {
      "id": "reimbursement_context",
      "label": "Reimbursement Context",
      "purpose": "Summarize current reimbursement and parity evidence."
    },
    {
      "id": "operations_context",
      "label": "Operations Context",
      "purpose": "Summarize current compliance, workflow, and adoption constraints."
    },
    {
      "id": "access_cost_context",
      "label": "Access vs Cost Context",
      "purpose": "Summarize access benefits, continuity gains, and cost uncertainty."
    },
    {
      "id": "claim_matrix",
      "label": "Claim Matrix",
      "purpose": "Map candidate claims to current supporting sources and mark stale or excluded claims.",
      "depends_on": [
        "utilization_context",
        "reimbursement_context",
        "operations_context",
        "access_cost_context"
      ]
    },
    {
      "id": "tension_analysis",
      "label": "Tension Analysis",
      "purpose": "Preserve conflicts and unresolved uncertainties.",
      "depends_on": [
        "access_cost_context"
      ]
    },
    {
      "id": "recommendation_criteria",
      "label": "Recommendation Criteria",
      "purpose": "Define recommendation criteria grounded in current claims and tensions.",
      "depends_on": [
        "claim_matrix",
        "tension_analysis"
      ]
    },
    {
      "id": "implementation_plan",
      "label": "Implementation Plan",
      "purpose": "Translate the recommendation criteria into rollout sequencing and guardrails.",
      "depends_on": [
        "recommendation_criteria",
        "operations_context"
      ]
    },
    {
      "id": "final_memo",
      "label": "Final Memo",
      "purpose": "Write the final memo using only the declared current artifacts.",
      "depends_on": [
        "claim_matrix",
        "tension_analysis",
        "recommendation_criteria",
        "implementation_plan"
      ]
    }
  ],
  "initial_stage_source_ids": {
    "utilization_context": ["S1"],
    "reimbursement_context": ["S2_current"],
    "operations_context": ["S3_current", "S6", "S7"],
    "access_cost_context": ["S4_current", "S5_current"]
  },
  "updated_stage_source_ids": {
    "utilization_context": ["S1"],
    "reimbursement_context": ["S2_current"],
    "operations_context": ["S3_current", "S6", "S7"],
    "access_cost_context": ["S4_current", "S5_current"]
  },
  "update_user_note": "Executive leadership updated the recommendation criteria: any year-one telehealth expansion must be budget-neutral and must include utilization controls before chronic-care follow-up expansion can scale.",
  "updated_stage_overrides": {
    "recommendation_criteria": "## Updated Recommendation Criteria\n- Any year-one telehealth expansion must be budget-neutral at the program level.\n- Behavioral-health follow-up may scale first where payer validation and compliance readiness are confirmed.\n- Chronic-care follow-up expansion may scale only after utilization controls, interval rules, and substitution guardrails are in place.\n- The final recommendation and implementation plan must explicitly reflect the budget-neutrality requirement and the utilization-control gate for chronic-care scaling."
  },
  "source_file": "sources.json",
  "ground_truth_file": "ground_truth.json",
  "edits_file": "edits.json",
  "memory_file": "memory/INDEX.md",
  "manual_intermediates": {
    "recommendation_criteria_current": [
      "Support targeted expansion where payer validation, compliance readiness, and utilization controls align.",
      "Do not claim system-wide savings."
    ],
    "implementation_plan_current": [
      "Lead with behavioral-health follow-up.",
      "Use payer/state readiness and compliance sequencing."
    ]
  }
}
